### ISSUE TITLE
Nova 227 and Opncell - mme connected but no network

### ISSUE THREAD

**Issue by AndreaGini** [opncell/opncell#18]
I'm having some trouble getting a nova 227 to work with opncell, configuration looks right, no error messages in the log files, nova connects to mme , but the UE doesn't see any network. The UE supports the band (B48) and the antenna RF is on (I can see the carrier frequency on hackrf )

Any help will be appreciated!

OPNCELL:
<img width="887" alt="Image" src="https://github.com/user-attachments/assets/d9e9b2cb-45dc-4317-a1b1-de8950ff5201" />
<img width="1263" alt="Image" src="https://github.com/user-attachments/assets/132f9da4-f601-4952-8afe-13ee18a844e6" />

OPNCELL LOGS:
`
==> mme.log <==
01/16 20:06:14.392: [metrics] INFO: metrics_server() [http://127.0.0.2]:9090 (../lib/metrics/prometheus/context.c:300)
01/16 20:06:14.449: [gtp] INFO: gtp_server() [127.0.0.2]:2123 (../lib/gtp/path.c:31)
01/16 20:06:14.449: [gtp] INFO: gtp_connect() [127.0.0.3]:2123 (../lib/gtp/path.c:61)
01/16 20:06:14.449: [mme] INFO: s1ap_server() [192.168.10.240]:36412 (../src/mme/s1ap-sctp.c:63)
01/16 20:06:14.449: [sctp] INFO: MME initialize...done (../src/mme/app-init.c:33)
01/16 20:06:14.451: [diam] INFO: CONNECTED TO 'hss.localdomain' (TCP,soc#13): (../lib/diameter/common/logger.c:108)
01/16 20:10:27.216: [mme] INFO: eNB-S1 accepted[192.168.10.230]:36412 in s1_path module (../src/mme/s1ap-sctp.c:115)
01/16 20:10:27.216: [mme] INFO: eNB-S1 accepted[192.168.10.230] in master_sm module (../src/mme/mme-sm.c:109)
01/16 20:10:27.216: [mme] INFO: [Added] Number of eNBs is now 1 (../src/mme/mme-context.c:2843)
01/16 20:10:27.216: [mme] INFO: eNB-S1[192.168.10.230] max_num_of_ostreams : 10 (../src/mme/mme-sm.c:158)

==> nrf.log <==
01/16 20:07:02.903: [nrf] INFO: NF EndPoint(addr) setup [127.0.0.4:7777] (../src/nrf/nnrf-handler.c:418)
01/16 20:07:02.903: [nrf] INFO: [11d4fc1a-d43d-41ef-8c43-ab4708fc6f50] Subscription created until 2025-01-17T20:07:02.903932+01:00 [duration:86400000000,validity:86400.000000] (../src/nrf/nnrf-handler.c:452)
01/16 20:07:02.903: [nrf] INFO: NF EndPoint(addr) setup [127.0.0.4:7777] (../src/nrf/nnrf-handler.c:418)
01/16 20:07:02.903: [nrf] INFO: [11d4fecc-d43d-41ef-8c43-ab4708fc6f50] Subscription created until 2025-01-17T20:07:02.903992+01:00 [duration:86400000000,validity:86400.000000] (../src/nrf/nnrf-handler.c:452)
01/16 20:07:02.904: [nrf] INFO: NF EndPoint(addr) setup [127.0.0.4:7777] (../src/nrf/nnrf-handler.c:418)
01/16 20:07:02.904: [nrf] INFO: [11d5020a-d43d-41ef-8c43-ab4708fc6f50] Subscription created until 2025-01-17T20:07:02.904071+01:00 [duration:86400000000,validity:86400.000000] (../src/nrf/nnrf-handler.c:452)
01/16 20:07:02.904: [nrf] INFO: NF EndPoint(addr) setup [127.0.0.4:7777] (../src/nrf/nnrf-handler.c:418)
01/16 20:07:02.904: [nrf] INFO: [11d5058e-d43d-41ef-8c43-ab4708fc6f50] Subscription created until 2025-01-17T20:07:02.904162+01:00 [duration:86400000000,validity:86400.000000] (../src/nrf/nnrf-handler.c:452)
01/16 20:07:02.904: [nrf] INFO: NF EndPoint(addr) setup [127.0.0.4:7777] (../src/nrf/nnrf-handler.c:418)
01/16 20:07:02.904: [nrf] INFO: [11d50692-d43d-41ef-8c43-ab4708fc6f50] Subscription created until 2025-01-17T20:07:02.904187+01:00 [duration:86400000000,validity:86400.000000] (../src/nrf/nnrf-handler.c:452)

==> pcrf.log <==
01/16 20:11:21.879: [app] INFO: File Logging: '/var/log/opncell/pcrf.log' (../lib/app/ogs-init.c:136)
01/16 20:11:21.887: [dbi] WARNING: Failed to connect to server [mongodb://localhost/open5gs] (../lib/dbi/ogs-mongoc.c:122)
01/16 20:11:21.887: [app] WARNING: Failed to initialize PCRF (../src/pcrf/app-init.c:28)
Open5GS daemon v2.7.2-1-g3743097

01/16 20:11:23.356: [app] INFO: Configuration: '/usr/local/etc/open5gs/pcrf.yaml' (../lib/app/ogs-init.c:133)
01/16 20:11:23.356: [app] INFO: File Logging: '/var/log/opncell/pcrf.log' (../lib/app/ogs-init.c:136)
01/16 20:11:23.364: [dbi] INFO: MongoDB URI: 'mongodb://localhost/open5gs' (../lib/dbi/ogs-mongoc.c:130)
01/16 20:11:23.458: [app] INFO: PCRF initialize...done (../src/pcrf/app-init.c:31)
01/16 20:11:23.460: [diam] INFO: CONNECTED TO 'smf.localdomain' (TCP,soc#10): (../lib/diameter/common/logger.c:108)

==> scp.log <==
01/16 20:06:56.741: [sbi] INFO: NF EndPoint(addr) setup [127.0.0.10:7777] (../lib/sbi/nnrf-handler.c:949)
01/16 20:06:56.741: [sbi] INFO: [0e28923e-d43d-41ef-8c43-ab4708fc6f50] Subscription created until 2025-01-17T20:06:56.740832+01:00 [duration:86400000000,validity:86400.000000,patch:43200.000000] (../lib/sbi/nnrf-handler.c:874)
01/16 20:06:56.741: [sbi] INFO: NF EndPoint(addr) setup [127.0.0.10:7777] (../lib/sbi/nnrf-handler.c:949)
01/16 20:06:56.741: [sbi] INFO: [0e2894aa-d43d-41ef-8c43-ab4708fc6f50] Subscription created until 2025-01-17T20:06:56.740894+01:00 [duration:86400000000,validity:86400.000000,patch:43200.000000] (../lib/sbi/nnrf-handler.c:874)
01/16 20:06:56.741: [sbi] INFO: NF EndPoint(addr) setup [127.0.0.10:7777] (../lib/sbi/nnrf-handler.c:949)
01/16 20:06:56.741: [sbi] INFO: [0e289734-d43d-41ef-8c43-ab4708fc6f50] Subscription created until 2025-01-17T20:06:56.740960+01:00 [duration:86400000000,validity:86400.000000,patch:43200.000000] (../lib/sbi/nnrf-handler.c:874)
01/16 20:07:02.903: [sbi] INFO: [f8b82c3e-d43c-41ef-8711-277106efe43d] (NRF-notify) NF registered (../lib/sbi/nnrf-handler.c:1133)
01/16 20:07:02.903: [sbi] INFO: [f8b82c3e-d43c-41ef-8711-277106efe43d] (NRF-notify) NF Profile updated [type:SMF] (../lib/sbi/nnrf-handler.c:1149)
01/16 20:07:02.903: [sbi] INFO: NF EndPoint(addr) setup [127.0.0.4:80] (../lib/sbi/context.c:2195)
01/16 20:07:02.903: [sbi] INFO: NF EndPoint(addr) setup [127.0.0.4:7777] (../lib/sbi/context.c:1934)

==> sgwc.log <==
Open5GS daemon v2.7.2-1-g3743097

01/16 20:06:29.613: [app] INFO: Configuration: '/usr/local/etc/open5gs/sgwc.yaml' (../lib/app/ogs-init.c:133)
01/16 20:06:29.613: [app] INFO: File Logging: '/var/log/opncell/sgwc.log' (../lib/app/ogs-init.c:136)
01/16 20:06:29.648: [gtp] INFO: gtp_server() [127.0.0.3]:2123 (../lib/gtp/path.c:31)
01/16 20:06:29.648: [pfcp] INFO: pfcp_server() [127.0.0.3]:8805 (../lib/pfcp/path.c:31)
01/16 20:06:29.648: [pfcp] INFO: ogs_pfcp_connect() [127.0.0.6]:8805 (../lib/pfcp/path.c:62)
01/16 20:06:29.649: [app] INFO: SGW-C initialize...done (../src/sgwc/app.c:31)
01/16 20:06:29.649: [sgwc] INFO: PFCP associated [127.0.0.6]:8805 (../src/sgwc/pfcp-sm.c:185)

==> smf.log <==
01/16 20:07:02.904: [sbi] INFO: [11d4fc1a-d43d-41ef-8c43-ab4708fc6f50] Subscription created until 2025-01-17T20:07:02.903932+01:00 [duration:86400000000,validity:86400.000000,patch:43200.000000] (../lib/sbi/nnrf-handler.c:874)
01/16 20:07:02.904: [sbi] INFO: NF EndPoint(addr) setup [127.0.0.10:7777] (../lib/sbi/nnrf-handler.c:949)
01/16 20:07:02.904: [sbi] INFO: [11d4fecc-d43d-41ef-8c43-ab4708fc6f50] Subscription created until 2025-01-17T20:07:02.903992+01:00 [duration:86400000000,validity:86400.000000,patch:43200.000000] (../lib/sbi/nnrf-handler.c:874)
01/16 20:07:02.904: [sbi] INFO: NF EndPoint(addr) setup [127.0.0.10:7777] (../lib/sbi/nnrf-handler.c:949)
01/16 20:07:02.904: [sbi] INFO: [11d5020a-d43d-41ef-8c43-ab4708fc6f50] Subscription created until 2025-01-17T20:07:02.904071+01:00 [duration:86400000000,validity:86400.000000,patch:43200.000000] (../lib/sbi/nnrf-handler.c:874)
01/16 20:07:02.904: [sbi] INFO: NF EndPoint(addr) setup [127.0.0.10:7777] (../lib/sbi/nnrf-handler.c:949)
01/16 20:07:02.904: [sbi] INFO: [11d5058e-d43d-41ef-8c43-ab4708fc6f50] Subscription created until 2025-01-17T20:07:02.904162+01:00 [duration:86400000000,validity:86400.000000,patch:43200.000000] (../lib/sbi/nnrf-handler.c:874)
01/16 20:07:02.904: [sbi] INFO: NF EndPoint(addr) setup [127.0.0.10:7777] (../lib/sbi/nnrf-handler.c:949)
01/16 20:07:02.904: [sbi] INFO: [11d50692-d43d-41ef-8c43-ab4708fc6f50] Subscription created until 2025-01-17T20:07:02.904187+01:00 [duration:86400000000,validity:86400.000000,patch:43200.000000] (../lib/sbi/nnrf-handler.c:874)
01/16 20:11:23.459: [diam] INFO: CONNECTED TO 'pcrf.localdomain' (TCP,soc#11): (../lib/diameter/common/logger.c:108)

`

NOVA 227 Configuration:

<img width="964" alt="Image" src="https://github.com/user-attachments/assets/095a7af2-1c7c-4510-b5ef-95e28bac6b9e" />

**Comment by rhamblet** [comment]
Andrea,

You’ll want to increase the bandwidth on the Nova to 10MHz or 20MHz.

We typically bind to a different IP for the SGWu (other than the MME’s).

Have you verified the UE is capable of B48?

Regards,

Rob Hamblet

**Comment by rhamblet** [comment]
Andrea,

Create another Virtual IP under Interfaces on the same segment with the same mask. 

	192.168.2.2/24	 	S1N3	IP Alias	SGWu

Then edit the SGWu bind address and point it to the new virtual IP.

Regards,

Rob Hamblet

**Comment by AndreaGini** [comment]
Ok I will try, Thank you !!!

**Comment by AndreaGini** [comment]
No changes on the Nova?

**Comment by rhamblet** [comment]
No changes on the eNB - the MME tells it where to deliver the GTP traffic.

**Comment by AndreaGini** [comment]
Hi Rob,

I did all that, same result.
A tcpdump on the opncell only shows sctp traffic

`09:30:45.244278 IP 4g-opnsense.36412 > 192.168.10.230.36412: sctp (1) [HB REQ] 
09:30:45.248186 IP 192.168.10.230.36412 > 4g-opnsense.36412: sctp (1) [HB ACK] 
09:30:46.178491 IP 192.168.10.230.36412 > 4g-opnsense.36412: sctp (1) [HB REQ] 
09:30:46.178512 IP 4g-opnsense.36412 > 192.168.10.230.36412: sctp (1) [HB ACK] 
09:30:51.299532 IP 4g-opnsense.36412 > 192.168.10.230.36412: sctp (1) [HB REQ] 
09:30:51.308216 IP 192.168.10.230.36412 > 4g-opnsense.36412: sctp (1) [HB ACK] 
09:30:51.678355 IP 192.168.10.230.36412 > 4g-opnsense.36412: sctp (1) [HB REQ] 
09:30:51.678376 IP 4g-opnsense.36412 > 192.168.10.230.36412: sctp (1) [HB ACK] 
09:30:57.078312 IP 192.168.10.230.36412 > 4g-opnsense.36412: sctp (1) [HB REQ] 
09:30:57.078343 IP 4g-opnsense.36412 > 192.168.10.230.36412: sctp (1) [HB ACK] 
09:30:57.164373 IP 4g-opnsense.36412 > 192.168.10.230.36412: sctp (1) [HB REQ] 
09:30:57.168387 IP 192.168.10.230.36412 > 4g-opnsense.36412: sctp (1) [HB ACK] `

Attaching the config file from my nova , if you see something wrong, but I compared it with the one you posted in [https://github.com/opncell/opncell/issues/17](url) and it seems pretty much the same configuration to me


[CellConfig_20250117_092220.tar.gz](https://github.com/user-attachments/files/18451265/CellConfig_20250117_092220.tar.gz)

**Comment by AndreaGini** [comment]
UPDATE:
I installed cellsearch and scanning my center frequency give me the expoected result of finding the TDD cell

  Detected a TDD cell! At freqeuncy 3650MHz
    cell ID: 1
     PSS ID: 1
    RX power level: -15.5946 dB
    residual frequency offset: -981.316 Hz
                     k_factor: 1
Detected the following cells:
DPX:TDD/FDD; A: #antenna ports C: CP type ; P: PHICH duration ; PR: PHICH resource type
DPX CID A      fc   freq-offset RXPWR C nRB P  PR CrystalCorrectionFactor
FDD 232255   3650M         4.51k -15.6 N 255 U UNK 1.0000012354392684433
TDD   1255   3650M         -981h -15.6 N 255 U UNK 0.99999973114629081561

But from UE I still cannot see the network , if I do a manual scan I'm supposed to see my mcc/mnc but I don't see anythig

Can it be related with Baicells configuration?


I also checked , between the server and the antenna there's only 1 switch, no firewall , no router

**Comment by fuzzylogicbits** [comment]
Hi AndreaGini, 

A dumb question for you .. ..
What SIM are you using with the Iphone ?, (my understanding  is that Iphone 16 only uses eSIM)
If you are using an eSIM, how did you integrate that with OpnCell ? 

Faisal

**Comment by rhamblet** [comment]
Here is some Apple guidance on allowed PLMNs https://support.apple.com/en-euro/guide/deployment/depac6747317/web

Regards,

Rob

**Comment by AndreaGini** [comment]
Hi Rob,

yeah "Worldwide MCC 999" is definitely supported and that's what I'm using

I opened a support ticket to Baicells, let's see what they will discover, might be an enodeb hardware problem

**Comment by rhamblet** [comment]
Faisal,

Today we use eSIM technology provided by Teal Communications.  Teal provides both physical and embedded (eSIM QR) credentials.

Regards,

Rob Hamblet

**Comment by syadnom** [comment]
@rhamblet you are getting eSIMs to work on nova227 in CBRS on mobile phones?   I bit off-topic but can they 'burn' eSIMs with baicells PLMN that work or would this require Opncell?

We're considering opncell to replace HaloB on all our baicells. eSIMs would be great.

**Comment by rhamblet** [comment]
Yes we are on the Stellar 227 (not Neutrino).  A bit tricky initially but proper configuration of SUPI SUCI works and is under (successful) testing and validation using our SMDP+.  Are we able to provide credentials for Baicells 4FF physical IMSIs - yes that could be provided as well as eSIM QR/URL codes.  You’ll need to provide the IMSI range.  OPNcell has been making big inroads in the stand alone needs and is proving to be a very stable and secure solution.

-Rob
